{
  "name": "ToolVault Starter Index",
  "version": "1.0.0",
  "description": "Curated collection of analysis tools for demonstration purposes.",
  "updated": "2025-08-15T12:00:00Z",
  "tools": [
    {
      "id": "word-count",
      "name": "Word Count",
      "description": "Counts the number of words, characters, and sentences in text.",
      "category": "Text Analysis",
      "tags": ["text", "analysis", "count"],
      "module": "/src/tools/word-count/index.ts",
      "inputs": [
        {
          "name": "text",
          "label": "Text to analyse",
          "type": "string",
          "required": true
        }
      ],
      "outputs": [
        {
          "name": "count",
          "label": "Word count",
          "type": "number"
        },
        {
          "name": "characters",
          "label": "Character count (with spaces)",
          "type": "number"
        },
        {
          "name": "charactersNoSpaces",
          "label": "Character count (without spaces)",
          "type": "number"
        },
        {
          "name": "sentences",
          "label": "Sentence count",
          "type": "number"
        },
        {
          "name": "words",
          "label": "Word list",
          "type": "array"
        }
      ]
    },
    {
      "id": "change-color-to-red",
      "name": "Change Color to Red",
      "description": "Takes a GeoJSON feature and sets its properties.color to red for map highlighting.",
      "category": "Geospatial",
      "tags": ["geojson", "map", "color", "highlight"],
      "module": "/src/tools/change-color-to-red/index.ts",
      "inputs": [
        {
          "name": "feature",
          "label": "GeoJSON Feature",
          "type": "geojson",
          "required": true
        }
      ],
      "outputs": [
        {
          "name": "feature",
          "label": "Updated GeoJSON Feature",
          "type": "geojson"
        },
        {
          "name": "originalColor",
          "label": "Original color value",
          "type": "string"
        },
        {
          "name": "colorChanged",
          "label": "Whether color was changed",
          "type": "boolean"
        }
      ]
    },
    {
      "id": "geo-buffer",
      "name": "Geospatial Buffer",
      "description": "Creates a buffer polygon around a given GeoJSON geometry.",
      "category": "Geospatial",
      "tags": ["geo", "buffer", "geometry"],
      "module": "/src/tools/geo-buffer/index.ts",
      "inputs": [
        {
          "name": "geometry",
          "label": "Input geometry (GeoJSON)",
          "type": "geojson",
          "required": true
        },
        {
          "name": "distance",
          "label": "Buffer distance (meters)",
          "type": "number",
          "required": true
        }
      ],
      "outputs": [
        {
          "name": "buffered_geometry",
          "label": "Buffered geometry",
          "type": "geojson"
        }
      ]
    },
    {
      "id": "json-validator",
      "name": "JSON Validator",
      "description": "Validates JSON syntax, formats it, and provides detailed error information.",
      "category": "Data Processing",
      "tags": ["json", "validation", "format"],
      "module": "/src/tools/json-validator/index.ts",
      "inputs": [
        {
          "name": "jsonString",
          "label": "JSON to validate",
          "type": "string",
          "required": true
        },
        {
          "name": "indent",
          "label": "Indentation spaces",
          "type": "number",
          "required": false
        }
      ],
      "outputs": [
        {
          "name": "isValid",
          "label": "Is valid JSON",
          "type": "boolean"
        },
        {
          "name": "formatted",
          "label": "Formatted JSON",
          "type": "string"
        },
        {
          "name": "error",
          "label": "Error message",
          "type": "string"
        }
      ]
    },
    {
      "id": "hash-generator",
      "name": "Hash Generator",
      "description": "Generates various hash values (MD5, SHA-1, SHA-256) for text input.",
      "category": "Security",
      "tags": ["hash", "md5", "sha", "security"],
      "module": "/src/tools/hash-generator/index.ts",
      "inputs": [
        {
          "name": "text",
          "label": "Text to hash",
          "type": "string",
          "required": true
        },
        {
          "name": "algorithms",
          "label": "Hash algorithms",
          "type": "array",
          "required": false
        }
      ],
      "outputs": [
        {
          "name": "hashes",
          "label": "Generated hashes",
          "type": "json"
        },
        {
          "name": "length",
          "label": "Input length",
          "type": "number"
        }
      ]
    },
    {
      "id": "base64-codec",
      "name": "Base64 Encoder/Decoder",
      "description": "Encodes text to Base64 or decodes Base64 to text with URL-safe option.",
      "category": "Data Processing",
      "tags": ["base64", "encode", "decode", "url-safe"],
      "module": "/src/tools/base64-codec/index.ts",
      "inputs": [
        {
          "name": "text",
          "label": "Text to encode/decode",
          "type": "string",
          "required": true
        },
        {
          "name": "operation",
          "label": "Operation",
          "type": "string",
          "required": true
        },
        {
          "name": "urlSafe",
          "label": "URL-safe encoding",
          "type": "boolean",
          "required": false
        }
      ],
      "outputs": [
        {
          "name": "output",
          "label": "Result",
          "type": "string"
        },
        {
          "name": "operation",
          "label": "Operation performed",
          "type": "string"
        }
      ]
    }
  ]
}